{
  "_comment": "Machine-readable SVG 2 vocabulary for the elm-typed-svg API-vs-spec audit (Task 1). elements from eltindex.html; presentation properties from propidx.html (+ marker sub-props and 4 filter-scoped props from the Filter Effects chapter); element-specific structural/geometry/animation/event/aria attributes from attindex.html. Parsed by regex over the raw W3C HTML, not hand-transcribed.",
  "provenance": {
    "specUrls": [
      "https://www.w3.org/TR/SVG2/eltindex.html",
      "https://www.w3.org/TR/SVG2/attindex.html",
      "https://www.w3.org/TR/SVG2/propidx.html"
    ],
    "crossCheckedAgainst": [
      "https://developer.mozilla.org/en-US/docs/Web/SVG/Reference/Element",
      "https://developer.mozilla.org/en-US/docs/Web/SVG/Reference/Attribute"
    ],
    "fetchedAt": "2026-08-21",
    "specStatus": "SVG 2 W3C Candidate Recommendation (living target)"
  },
  "counts": {
    "elements": 69,
    "presentationProperties": 45,
    "finiteEnumPresentationProperties": 21,
    "attributesTotal": 306
  },
  "elements": [
    {
      "name": "a",
      "family": "static-render",
      "specHref": "linking.html#AElement",
      "inMdnReference": true
    },
    {
      "name": "animate",
      "family": "smil-animation",
      "specHref": "https://svgwg.org/specs/animations/#AnimateElement",
      "inMdnReference": true
    },
    {
      "name": "animateMotion",
      "family": "smil-animation",
      "specHref": "https://svgwg.org/specs/animations/#AnimateMotionElement",
      "inMdnReference": true
    },
    {
      "name": "animateTransform",
      "family": "smil-animation",
      "specHref": "https://svgwg.org/specs/animations/#AnimateTransformElement",
      "inMdnReference": true
    },
    {
      "name": "audio",
      "family": "html-embed",
      "specHref": "embedded.html#HTMLElements",
      "inMdnReference": false
    },
    {
      "name": "canvas",
      "family": "html-embed",
      "specHref": "embedded.html#HTMLElements",
      "inMdnReference": false
    },
    {
      "name": "circle",
      "family": "static-render",
      "specHref": "shapes.html#CircleElement",
      "inMdnReference": true
    },
    {
      "name": "clipPath",
      "family": "static-render",
      "specHref": "https://drafts.fxtf.org/css-masking-1/#ClipPathElement",
      "inMdnReference": true
    },
    {
      "name": "defs",
      "family": "static-render",
      "specHref": "struct.html#DefsElement",
      "inMdnReference": true
    },
    {
      "name": "desc",
      "family": "static-render",
      "specHref": "struct.html#DescElement",
      "inMdnReference": true
    },
    {
      "name": "discard",
      "family": "smil-animation",
      "specHref": "https://svgwg.org/specs/animations/#DiscardElement",
      "inMdnReference": false
    },
    {
      "name": "ellipse",
      "family": "static-render",
      "specHref": "shapes.html#EllipseElement",
      "inMdnReference": true
    },
    {
      "name": "feBlend",
      "family": "filter",
      "specHref": "https://drafts.fxtf.org/filter-effects/#feBlendElement",
      "inMdnReference": true
    },
    {
      "name": "feColorMatrix",
      "family": "filter",
      "specHref": "https://drafts.fxtf.org/filter-effects/#feColorMatrixElement",
      "inMdnReference": true
    },
    {
      "name": "feComponentTransfer",
      "family": "filter",
      "specHref": "https://drafts.fxtf.org/filter-effects/#feComponentTransferElement",
      "inMdnReference": true
    },
    {
      "name": "feComposite",
      "family": "filter",
      "specHref": "https://drafts.fxtf.org/filter-effects/#feCompositeElement",
      "inMdnReference": true
    },
    {
      "name": "feConvolveMatrix",
      "family": "filter",
      "specHref": "https://drafts.fxtf.org/filter-effects/#feConvolveMatrixElement",
      "inMdnReference": true
    },
    {
      "name": "feDiffuseLighting",
      "family": "filter",
      "specHref": "https://drafts.fxtf.org/filter-effects/#feDiffuseLightingElement",
      "inMdnReference": true
    },
    {
      "name": "feDisplacementMap",
      "family": "filter",
      "specHref": "https://drafts.fxtf.org/filter-effects/#feDisplacementMapElement",
      "inMdnReference": true
    },
    {
      "name": "feDistantLight",
      "family": "filter",
      "specHref": "https://drafts.fxtf.org/filter-effects/#feDistantLightElement",
      "inMdnReference": true
    },
    {
      "name": "feDropShadow",
      "family": "filter",
      "specHref": "https://drafts.fxtf.org/filter-effects/#feDropShadowElement",
      "inMdnReference": true
    },
    {
      "name": "feFlood",
      "family": "filter",
      "specHref": "https://drafts.fxtf.org/filter-effects/#feFloodElement",
      "inMdnReference": true
    },
    {
      "name": "feFuncA",
      "family": "filter",
      "specHref": "https://drafts.fxtf.org/filter-effects/#feFuncAElement",
      "inMdnReference": true
    },
    {
      "name": "feFuncB",
      "family": "filter",
      "specHref": "https://drafts.fxtf.org/filter-effects/#feFuncBElement",
      "inMdnReference": true
    },
    {
      "name": "feFuncG",
      "family": "filter",
      "specHref": "https://drafts.fxtf.org/filter-effects/#feFuncGElement",
      "inMdnReference": true
    },
    {
      "name": "feFuncR",
      "family": "filter",
      "specHref": "https://drafts.fxtf.org/filter-effects/#feFuncRElement",
      "inMdnReference": true
    },
    {
      "name": "feGaussianBlur",
      "family": "filter",
      "specHref": "https://drafts.fxtf.org/filter-effects/#feGaussianBlurElement",
      "inMdnReference": true
    },
    {
      "name": "feImage",
      "family": "filter",
      "specHref": "https://drafts.fxtf.org/filter-effects/#feImageElement",
      "inMdnReference": true
    },
    {
      "name": "feMerge",
      "family": "filter",
      "specHref": "https://drafts.fxtf.org/filter-effects/#feMergeElement",
      "inMdnReference": true
    },
    {
      "name": "feMergeNode",
      "family": "filter",
      "specHref": "https://drafts.fxtf.org/filter-effects/#feMergeElement",
      "inMdnReference": true
    },
    {
      "name": "feMorphology",
      "family": "filter",
      "specHref": "https://drafts.fxtf.org/filter-effects/#feMorphologyElement",
      "inMdnReference": true
    },
    {
      "name": "feOffset",
      "family": "filter",
      "specHref": "https://drafts.fxtf.org/filter-effects/#feOffsetElement",
      "inMdnReference": true
    },
    {
      "name": "fePointLight",
      "family": "filter",
      "specHref": "https://drafts.fxtf.org/filter-effects/#fePointLightElement",
      "inMdnReference": true
    },
    {
      "name": "feSpecularLighting",
      "family": "filter",
      "specHref": "https://drafts.fxtf.org/filter-effects/#feSpecularLightingElement",
      "inMdnReference": true
    },
    {
      "name": "feSpotLight",
      "family": "filter",
      "specHref": "https://drafts.fxtf.org/filter-effects/#feSpotLightElement",
      "inMdnReference": true
    },
    {
      "name": "feTile",
      "family": "filter",
      "specHref": "https://drafts.fxtf.org/filter-effects/#feTileElement",
      "inMdnReference": true
    },
    {
      "name": "feTurbulence",
      "family": "filter",
      "specHref": "https://drafts.fxtf.org/filter-effects/#feTurbulenceElement",
      "inMdnReference": true
    },
    {
      "name": "filter",
      "family": "filter",
      "specHref": "https://drafts.fxtf.org/filter-effects/#FilterElement",
      "inMdnReference": true
    },
    {
      "name": "foreignObject",
      "family": "static-render",
      "specHref": "embedded.html#ForeignObjectElement",
      "inMdnReference": true
    },
    {
      "name": "g",
      "family": "static-render",
      "specHref": "struct.html#GElement",
      "inMdnReference": true
    },
    {
      "name": "iframe",
      "family": "html-embed",
      "specHref": "embedded.html#HTMLElements",
      "inMdnReference": false
    },
    {
      "name": "image",
      "family": "static-render",
      "specHref": "embedded.html#ImageElement",
      "inMdnReference": true
    },
    {
      "name": "line",
      "family": "static-render",
      "specHref": "shapes.html#LineElement",
      "inMdnReference": true
    },
    {
      "name": "linearGradient",
      "family": "static-render",
      "specHref": "pservers.html#LinearGradientElement",
      "inMdnReference": true
    },
    {
      "name": "marker",
      "family": "static-render",
      "specHref": "painting.html#MarkerElement",
      "inMdnReference": true
    },
    {
      "name": "mask",
      "family": "static-render",
      "specHref": "https://drafts.fxtf.org/css-masking-1/#MaskElement",
      "inMdnReference": true
    },
    {
      "name": "metadata",
      "family": "non-rendering-metadata",
      "specHref": "struct.html#MetadataElement",
      "inMdnReference": true
    },
    {
      "name": "mpath",
      "family": "smil-animation",
      "specHref": "https://svgwg.org/specs/animations/#MPathElement",
      "inMdnReference": true
    },
    {
      "name": "path",
      "family": "static-render",
      "specHref": "paths.html#PathElement",
      "inMdnReference": true
    },
    {
      "name": "pattern",
      "family": "static-render",
      "specHref": "pservers.html#PatternElement",
      "inMdnReference": true
    },
    {
      "name": "polygon",
      "family": "static-render",
      "specHref": "shapes.html#PolygonElement",
      "inMdnReference": true
    },
    {
      "name": "polyline",
      "family": "static-render",
      "specHref": "shapes.html#PolylineElement",
      "inMdnReference": true
    },
    {
      "name": "radialGradient",
      "family": "static-render",
      "specHref": "pservers.html#RadialGradientElement",
      "inMdnReference": true
    },
    {
      "name": "rect",
      "family": "static-render",
      "specHref": "shapes.html#RectElement",
      "inMdnReference": true
    },
    {